{
  "schema_version": 1,
  "course": "bodysense-agent-extension",
  "baseline": {
    "checked_at": "2026-09-07",
    "source": "current repository architecture and prior Diagnosis learning evidence"
  },
  "items": [
    {
      "id": "BS-A1",
      "kind": "extension",
      "source": {
        "course": "bodysense-agent-extension",
        "title": "Typed Agent boundary",
        "verification": "PROJECT_DEFINED",
        "authority": "BodySense current architecture"
      },
      "lifecycle": "EXERCISE_READY",
      "mapping": {
        "mode": "DIRECT",
        "exercise_id": "BS-A1",
        "semantic_audit": "project-defined",
        "objective": "Typed Agent boundary",
        "target_files": [
          "apps/ai-service/src",
          "apps/api/internal/service/agent_deployment_policy.go",
          "docs/architecture/agent-platform-role-governance.md"
        ],
        "task_summary": "Trace one Diagnosis or Treatment execution from Go deployment/config selection into Python PydanticAI typed dependencies/output and through LiteLLM logical routing, then back to Go validation/persistence authority.",
        "completion_evidence_plan": [
          "Use focused existing configuration/agent identity tests in Go/Python for the selected role",
          "Record a configuration -> logical model -> execution provenance trace from code/tests."
        ],
        "prerequisites": [],
        "exercise_card": "../../exercises/bs-a1.md",
        "dependency_audit": "REVIEWED"
      },
      "mastery": {
        "required": "L4",
        "current": null,
        "evidence": []
      }
    },
    {
      "id": "BS-A2",
      "kind": "extension",
      "source": {
        "course": "bodysense-agent-extension",
        "title": "Runtime ownership and durable truth",
        "verification": "PROJECT_DEFINED",
        "authority": "BodySense current architecture"
      },
      "lifecycle": "EXERCISE_READY",
      "mapping": {
        "mode": "DIRECT",
        "exercise_id": "BS-A2",
        "semantic_audit": "project-defined",
        "objective": "Runtime ownership and durable truth",
        "target_files": [
          "docs/architecture/current-longitudinal-system.md",
          "apps/api/internal/service/diagnosis_analysis_service.go",
          "apps/api/internal/service/treatment_service.go",
          "apps/ai-service/src"
        ],
        "task_summary": "Build an ownership matrix for one end-to-end Agent-backed flow. Trace where ephemeral thread state stops and durable Go-owned business artifacts begin, including exact BodyState revision pinning.",
        "completion_evidence_plan": [
          "Compare the matrix against `current-longitudinal-system.md`, route/service code and at least one persistence test",
          "No code change required when ownership is already explicit."
        ],
        "prerequisites": [
          "BS-A1"
        ],
        "exercise_card": "../../exercises/bs-a2.md",
        "dependency_audit": "REVIEWED"
      },
      "mastery": {
        "required": "L4",
        "current": null,
        "evidence": []
      }
    },
    {
      "id": "BS-A3",
      "kind": "extension",
      "source": {
        "course": "bodysense-agent-extension",
        "title": "Evidence, RAG and admissibility",
        "verification": "PROJECT_DEFINED",
        "authority": "BodySense current architecture"
      },
      "lifecycle": "MAPPED",
      "mapping": {
        "mode": "DIRECT",
        "exercise_id": "BS-A3",
        "semantic_audit": "project-defined",
        "objective": "Evidence, RAG and admissibility",
        "target_files": [
          "apps/ai-service/src",
          "apps/ai-service/tests/unit/test_diagnosis_evidence_acquisition.py"
        ],
        "task_summary": "Construct retrieved-but-inadmissible evidence and locate the deterministic rejection gate.",
        "completion_evidence_plan": [
          "prediction",
          "focused test/trace",
          "explain-back"
        ],
        "prerequisites": [],
        "exercise_card": null,
        "dependency_audit": "UNMODELED"
      },
      "mastery": {
        "required": "L4",
        "current": null,
        "evidence": []
      }
    },
    {
      "id": "BS-A4",
      "kind": "extension",
      "source": {
        "course": "bodysense-agent-extension",
        "title": "Safety and decision authority",
        "verification": "PROJECT_DEFINED",
        "authority": "BodySense current architecture"
      },
      "lifecycle": "MAPPED",
      "mapping": {
        "mode": "DIRECT",
        "exercise_id": "BS-A4",
        "semantic_audit": "project-defined",
        "objective": "Safety and decision authority",
        "target_files": [
          "apps/api/internal/service/diagnosis_decision_policy.go",
          "apps/api/internal/service/diagnosis_decision_policy_test.go"
        ],
        "task_summary": "Predict authority outcomes for adversarial cases before running policy tests.",
        "completion_evidence_plan": [
          "prediction",
          "focused test/trace",
          "explain-back"
        ],
        "prerequisites": [],
        "exercise_card": null,
        "dependency_audit": "UNMODELED"
      },
      "mastery": {
        "required": "L4",
        "current": null,
        "evidence": []
      }
    },
    {
      "id": "BS-A5",
      "kind": "extension",
      "source": {
        "course": "bodysense-agent-extension",
        "title": "Evaluation and configuration qualification",
        "verification": "PROJECT_DEFINED",
        "authority": "BodySense current architecture"
      },
      "lifecycle": "MAPPED",
      "mapping": {
        "mode": "DIRECT",
        "exercise_id": "BS-A5",
        "semantic_audit": "project-defined",
        "objective": "Evaluation and configuration qualification",
        "target_files": [
          "apps/ai-service",
          "docs/plan/archive/2026-08-diagnosis-agent-platform"
        ],
        "task_summary": "Inspect one qualification dataset/report and state promotion/block evidence.",
        "completion_evidence_plan": [
          "prediction",
          "focused test/trace",
          "explain-back"
        ],
        "prerequisites": [],
        "exercise_card": null,
        "dependency_audit": "UNMODELED"
      },
      "mastery": {
        "required": "L4",
        "current": null,
        "evidence": []
      }
    },
    {
      "id": "BS-A6",
      "kind": "extension",
      "source": {
        "course": "bodysense-agent-extension",
        "title": "Decision trace and replay",
        "verification": "PROJECT_DEFINED",
        "authority": "BodySense current architecture"
      },
      "lifecycle": "MAPPED",
      "mapping": {
        "mode": "DIRECT",
        "exercise_id": "BS-A6",
        "semantic_audit": "project-defined",
        "objective": "Decision trace and replay",
        "target_files": [
          "apps/api/internal/service/diagnosis_replay_service.go",
          "apps/api/internal/service/diagnosis_replay_service_test.go"
        ],
        "task_summary": "Compare historical replay, counterfactual replay, and current re-analysis on one frozen case.",
        "completion_evidence_plan": [
          "prediction",
          "focused test/trace",
          "explain-back"
        ],
        "prerequisites": [],
        "exercise_card": null,
        "dependency_audit": "UNMODELED"
      },
      "mastery": {
        "required": "L4",
        "current": null,
        "evidence": []
      }
    },
    {
      "id": "BS-A7",
      "kind": "extension",
      "source": {
        "course": "bodysense-agent-extension",
        "title": "Streaming, interrupt/resume and HITL",
        "verification": "PROJECT_DEFINED",
        "authority": "BodySense current architecture"
      },
      "lifecycle": "EXERCISE_READY",
      "mapping": {
        "mode": "DIRECT",
        "exercise_id": "BS-A7",
        "semantic_audit": "project-defined",
        "objective": "Streaming, interrupt/resume and HITL",
        "target_files": [
          "apps/web/src/features/consultation/hooks/useSSEProcessor.ts",
          "apps/web/src/features/consultation/runtime/activeTurnReducer.ts",
          "apps/web/src/features/consultation/runtime/durableRunRecovery.ts",
          "apps/api/internal/service/consultation_service.go",
          "apps/api/internal/repository/runtime_event_repository.go"
        ],
        "task_summary": "Trace public event creation/persistence, `(run_id, seq)` ownership, parser/reducer deduplication, recovery, explicit cancellation, and interrupt resume. Separate transport state, Go durable ledger, and Python checkpoint state.",
        "completion_evidence_plan": [
          "`pnpm exec vitest run --config apps/web/vite.config.ts apps/web/src/features/consultation/runtime/activeTurnReducer.test.ts apps/web/src/features/consultation/runtime/durableRunRecovery.test.ts apps/web/src/features/consultation/hooks/useSSEProcessor.test.ts`",
          "`cd apps/api && go test ./internal/service ./internal/repository -run \"Consultation|RuntimeEvent\" -count=1`"
        ],
        "prerequisites": [
          "BS-A1",
          "BS-A2"
        ],
        "exercise_card": "../../exercises/bs-a7.md",
        "dependency_audit": "REVIEWED"
      },
      "mastery": {
        "required": "L4",
        "current": null,
        "evidence": []
      }
    },
    {
      "id": "BS-A8",
      "kind": "extension",
      "source": {
        "course": "bodysense-agent-extension",
        "title": "Agent production debugging",
        "verification": "PROJECT_DEFINED",
        "authority": "BodySense current architecture"
      },
      "lifecycle": "MAPPED",
      "mapping": {
        "mode": "DIRECT",
        "exercise_id": "BS-A8",
        "semantic_audit": "project-defined",
        "objective": "Agent production debugging",
        "target_files": [
          "apps/api/internal/service",
          "apps/ai-service/src"
        ],